[
  {
    "id": "anom-001",
    "type": "funding_spike",
    "severity": "high",
    "sigma": 2.6,
    "assets": ["crypto:btc-usdt"],
    "venues": ["binance"],
    "title": "BTC funding rate spike",
    "description": "Binance perp funding z-score reached 2.6, well above the 30d band.",
    "detected_at": "2026-06-07T12:00:00.000Z",
    "status": "active",
    "context_refs": ["feature:crypto:btc-usdt:2026-06-07T12:00:00Z"],
    "rule_ref": "rule:funding_z>2"
  },
  {
    "id": "anom-002",
    "type": "oi_surge",
    "severity": "medium",
    "sigma": 2.1,
    "assets": ["crypto:btc-usdt"],
    "venues": ["binance", "bybit"],
    "title": "Open interest surge",
    "description": "Aggregate OI rose 8.5% in one hour across venues.",
    "detected_at": "2026-06-07T12:01:00.000Z",
    "status": "active",
    "context_refs": []
  },
  {
    "id": "anom-003",
    "type": "volume_anomaly",
    "severity": "medium",
    "sigma": 1.9,
    "assets": ["crypto:eth-usdt"],
    "venues": ["binance"],
    "title": "ETH volume anomaly",
    "description": "Hourly volume z-score 1.9 versus 30d baseline.",
    "detected_at": "2026-06-07T12:02:00.000Z",
    "status": "acknowledged",
    "context_refs": []
  },
  {
    "id": "anom-004",
    "type": "correlation_break",
    "severity": "high",
    "sigma": 3.0,
    "assets": ["crypto:btc-usdt", "macro:spx"],
    "venues": [],
    "title": "BTC/SPX correlation break",
    "description": "30d rolling correlation flipped from +0.42 to -0.18, a 3-sigma move.",
    "detected_at": "2026-06-07T12:03:00.000Z",
    "status": "active",
    "context_refs": []
  },
  {
    "id": "anom-005",
    "type": "basis_dislocation",
    "severity": "low",
    "sigma": 1.5,
    "assets": ["crypto:btc-usdt"],
    "venues": ["binance", "okx"],
    "title": "Cross-venue basis dislocation",
    "description": "Binance-OKX perp basis widened to 4.4 bps, above the typical 1 bp.",
    "detected_at": "2026-06-07T12:04:00.000Z",
    "status": "active",
    "context_refs": []
  },
  {
    "id": "anom-006",
    "type": "whale_flow",
    "severity": "high",
    "sigma": null,
    "assets": ["crypto:btc-usdt"],
    "venues": ["binance"],
    "title": "Whale accumulation detected",
    "description": "950 BTC moved from a Binance hot wallet to an unknown cold wallet.",
    "detected_at": "2026-06-07T09:30:30.000Z",
    "status": "active",
    "context_refs": ["onchain:whale_transfer:f3a1c9e0"]
  },
  {
    "id": "anom-007",
    "type": "macro_approaching",
    "severity": "medium",
    "sigma": null,
    "assets": ["crypto:btc-usdt", "macro:dxy"],
    "venues": [],
    "title": "US CPI in 30 minutes",
    "description": "High-importance CPI print scheduled at 12:30 UTC; expect elevated volatility.",
    "detected_at": "2026-06-10T12:00:00.000Z",
    "status": "active",
    "context_refs": ["macro:us-cpi-2026-06"],
    "rule_ref": "rule:macro_window<30m"
  },
  {
    "id": "anom-008",
    "type": "liquidation_cluster",
    "severity": "medium",
    "sigma": null,
    "assets": ["crypto:btc-usdt"],
    "venues": ["binance"],
    "title": "Liquidation cluster",
    "description": "Liquidation cluster of 820.5 units between 69200 and 69400, above current price (short liquidations).",
    "detected_at": "2026-06-07T12:00:00.000Z",
    "status": "active",
    "context_refs": ["feature:crypto:btc-usdt:2026-06-07T12:00:00Z"],
    "rule_ref": "rule:liq_cluster_size>1"
  },
  {
    "id": "anom-009",
    "type": "news_cluster",
    "severity": "medium",
    "sigma": null,
    "assets": ["crypto:btc-usdt"],
    "venues": [],
    "title": "News cluster forming",
    "description": "2 relevant 'etf' headlines on crypto:btc-usdt within 120 min (avg relevance 0.85).",
    "detected_at": "2026-06-07T11:52:00.000Z",
    "status": "snoozed",
    "context_refs": ["news:news-2026-06-07-001", "news:news-2026-06-07-003"],
    "rule_ref": "rule:news_cluster>=2"
  },
  {
    "id": "anom-010",
    "type": "exchange_flow",
    "severity": "high",
    "sigma": null,
    "assets": ["crypto:btc-usdt"],
    "venues": [],
    "title": "Exchange flow",
    "description": "1850 crypto:btc-usdt net outflow from exchanges (~$126.3M).",
    "detected_at": "2026-06-07T00:00:00.000Z",
    "status": "active",
    "context_refs": ["onchain:exchange_flow:2026-06-07T00:00:00Z"],
    "rule_ref": "rule:exchange_amount_usd"
  }
]
